{
  "Elements": [
    {
      "__type": "MouseSpeedIndicator",
      "Id": 0,
      "Location": {
        "X": 83,
        "Y": 83
      },
      "Radius": 70
    }
  ],
  "Height": 166,
  "Version": 2,
  "Width": 166,
  "$schema": "https://raw.githubusercontent.com/justDeeevin/NuhxBoard/refs/heads/main/schemas/layout.json"
}
